"No.","Time","Source","Destination","Protocol","Length","Info"
"309471","5305.624364","172.16.115.20","202.77.162.213","TCP","60","1023  >  514 [SYN] Seq=0 Win=8760 Len=0 MSS=1460"
"309472","5305.624518","202.77.162.213","172.16.115.20","TCP","60","514  >  1023 [SYN, ACK] Seq=0 Ack=1 Win=33580 Len=0 MSS=1460"
"309473","5305.624724","172.16.115.20","202.77.162.213","TCP","60","1023  >  514 [ACK] Seq=1 Ack=1 Win=8760 Len=0"
"309474","5305.624896","172.16.115.20","202.77.162.213","RSH","60","Session Establishment"
"309475","5305.669123","202.77.162.213","172.16.115.20","TCP","60","514  >  1023 [ACK] Seq=1 Ack=2 Win=33580 Len=0"
"309476","5305.669370","172.16.115.20","202.77.162.213","RSH","139","Session Establishment"
"309480","5305.752994","202.77.162.213","172.16.115.20","RSH","60","Server username:root Server -> Client Data"
"309481","5305.753139","172.16.115.20","202.77.162.213","TCP","60","1023  >  514 [ACK] Seq=87 Ack=2 Win=8760 Len=0"
"309484","5305.808339","202.77.162.213","172.16.115.20","RSH","105","Server username:root Server -> Client Data"
"309485","5305.808670","172.16.115.20","202.77.162.213","TCP","60","1023  >  514 [FIN, ACK] Seq=87 Ack=53 Win=8760 Len=0"
"309486","5305.808808","202.77.162.213","172.16.115.20","TCP","60","514  >  1023 [ACK] Seq=53 Ack=88 Win=33580 Len=0"
"309487","5305.808987","202.77.162.213","172.16.115.20","TCP","60","514  >  1023 [FIN, ACK] Seq=53 Ack=88 Win=33580 Len=0"
"309488","5305.809140","172.16.115.20","202.77.162.213","TCP","60","1023  >  514 [ACK] Seq=88 Ack=54 Win=8760 Len=0"
"309489","5305.809792","172.16.115.20","202.77.162.213","TCP","60","1022  >  514 [SYN] Seq=0 Win=8760 Len=0 MSS=1460"
"309490","5305.809946","202.77.162.213","172.16.115.20","TCP","60","514  >  1022 [SYN, ACK] Seq=0 Ack=1 Win=33580 Len=0 MSS=1460"
"309491","5305.810111","172.16.115.20","202.77.162.213","TCP","60","1022  >  514 [ACK] Seq=1 Ack=1 Win=8760 Len=0"
"309492","5305.810228","172.16.115.20","202.77.162.213","RSH","60","Session Establishment"
"309494","5305.869066","202.77.162.213","172.16.115.20","TCP","60","514  >  1022 [ACK] Seq=1 Ack=2 Win=33580 Len=0"
"309495","5305.869300","172.16.115.20","202.77.162.213","RSH","125","Session Establishment"
"309502","5306.069073","202.77.162.213","172.16.115.20","TCP","60","514  >  1022 [ACK] Seq=1 Ack=73 Win=33580 Len=0"
"309556","5306.928787","202.77.162.213","172.16.115.20","RSH","60","Server username:root Server -> Client Data"
"309557","5306.928962","172.16.115.20","202.77.162.213","TCP","60","1022  >  514 [ACK] Seq=73 Ack=2 Win=8760 Len=0"
"309558","5306.929296","172.16.115.20","202.77.162.213","RSH","60","Server username:root Client -> Server data"
"309562","5306.988138","202.77.162.213","172.16.115.20","RSH","77","Server username:root Server -> Client Data"
"309563","5306.989297","172.16.115.20","202.77.162.213","RSH","60","Server username:root Client -> Server data"
"309564","5306.996238","202.77.162.213","172.16.115.20","RSH","1514","Server username:root Server -> Client Data"
"309565","5306.997493","202.77.162.213","172.16.115.20","RSH","1514","Server username:root Server -> Client Data"
"309566","5306.998731","202.77.162.213","172.16.115.20","RSH","1514","Server username:root Server -> Client Data"
"309567","5306.998799","172.16.115.20","202.77.162.213","TCP","60","1022  >  514 [ACK] Seq=75 Ack=1485 Win=24820 Len=0"
"309568","5306.998870","172.16.115.20","202.77.162.213","TCP","60","1022  >  514 [ACK] Seq=75 Ack=2945 Win=24820 Len=0"
"309569","5307.000340","202.77.162.213","172.16.115.20","RSH","1514","Server username:root Server -> Client Data"
"309570","5307.000514","172.16.115.20","202.77.162.213","TCP","60","1022  >  514 [ACK] Seq=75 Ack=5865 Win=24820 Len=0"
"309571","5307.003830","202.77.162.213","172.16.115.20","RSH","1514","Server username:root Server -> Client Data"
"309572","5307.005468","202.77.162.213","172.16.115.20","RSH","1514","Server username:root Server -> Client Data"
"309573","5307.006700","202.77.162.213","172.16.115.20","RSH","1514","Server username:root Server -> Client Data"
"309574","5307.006825","172.16.115.20","202.77.162.213","TCP","60","1022  >  514 [ACK] Seq=75 Ack=8785 Win=24820 Len=0"
"309575","5307.008023","202.77.162.213","172.16.115.20","RSH","1514","Server username:root Server -> Client Data"
"309576","5307.009245","202.77.162.213","172.16.115.20","RSH","1514","Server username:root Server -> Client Data"
"309577","5307.009322","172.16.115.20","202.77.162.213","TCP","60","1022  >  514 [ACK] Seq=75 Ack=11705 Win=24820 Len=0"
"309578","5307.010554","202.77.162.213","172.16.115.20","RSH","1514","Server username:root Server -> Client Data"
"309579","5307.010728","172.16.115.20","202.77.162.213","TCP","60","1022  >  514 [ACK] Seq=75 Ack=14625 Win=24820 Len=0"
"309580","5307.015519","202.77.162.213","172.16.115.20","RSH","1514","Server username:root Server -> Client Data"
"309581","5307.016885","202.77.162.213","172.16.115.20","RSH","1514","Server username:root Server -> Client Data"
"309582","5307.018155","202.77.162.213","172.16.115.20","RSH","1514","Server username:root Server -> Client Data"
"309583","5307.018219","172.16.115.20","202.77.162.213","TCP","60","1022  >  514 [ACK] Seq=75 Ack=17545 Win=24820 Len=0"
"309584","5307.019538","202.77.162.213","172.16.115.20","RSH","1514","Server username:root Server -> Client Data"
"309585","5307.020774","202.77.162.213","172.16.115.20","RSH","1514","Server username:root Server -> Client Data"
"309586","5307.020853","172.16.115.20","202.77.162.213","TCP","60","1022  >  514 [ACK] Seq=75 Ack=20465 Win=24820 Len=0"
"309587","5307.022150","202.77.162.213","172.16.115.20","RSH","1514","Server username:root Server -> Client Data"
"309588","5307.023361","202.77.162.213","172.16.115.20","RSH","1514","Server username:root Server -> Client Data"
"309589","5307.023441","172.16.115.20","202.77.162.213","TCP","60","1022  >  514 [ACK] Seq=75 Ack=23385 Win=24820 Len=0"
"309590","5307.024683","202.77.162.213","172.16.115.20","RSH","1514","Server username:root Server -> Client Data"
"309591","5307.025906","202.77.162.213","172.16.115.20","RSH","1514","Server username:root Server -> Client Data"
"309592","5307.025981","172.16.115.20","202.77.162.213","TCP","60","1022  >  514 [ACK] Seq=75 Ack=26305 Win=24820 Len=0"
"309593","5307.027224","202.77.162.213","172.16.115.20","RSH","1514","Server username:root Server -> Client Data"
"309594","5307.027403","172.16.115.20","202.77.162.213","TCP","60","1022  >  514 [ACK] Seq=75 Ack=29225 Win=24820 Len=0"
"309595","5307.028634","202.77.162.213","172.16.115.20","RSH","1514","Server username:root Server -> Client Data"
"309596","5307.029882","202.77.162.213","172.16.115.20","RSH","1514","Server username:root Server -> Client Data"
"309597","5307.031206","202.77.162.213","172.16.115.20","RSH","1514","Server username:root Server -> Client Data"
"309598","5307.031275","172.16.115.20","202.77.162.213","TCP","60","1022  >  514 [ACK] Seq=75 Ack=32145 Win=24820 Len=0"
"309599","5307.032603","202.77.162.213","172.16.115.20","RSH","1514","Server username:root Server -> Client Data"
"309600","5307.033832","202.77.162.213","172.16.115.20","RSH","1514","Server username:root Server -> Client Data"
"309601","5307.033910","172.16.115.20","202.77.162.213","TCP","60","1022  >  514 [ACK] Seq=75 Ack=35065 Win=24820 Len=0"
"309602","5307.035414","202.77.162.213","172.16.115.20","RSH","1514","Server username:root Server -> Client Data"
"309603","5307.036644","202.77.162.213","172.16.115.20","RSH","1514","Server username:root Server -> Client Data"
"309604","5307.036726","172.16.115.20","202.77.162.213","TCP","60","1022  >  514 [ACK] Seq=75 Ack=37985 Win=24820 Len=0"
"309605","5307.037976","202.77.162.213","172.16.115.20","RSH","1514","Server username:root Server -> Client Data"
"309606","5307.039216","202.77.162.213","172.16.115.20","RSH","1514","Server username:root Server -> Client Data"
"309607","5307.039294","172.16.115.20","202.77.162.213","TCP","60","1022  >  514 [ACK] Seq=75 Ack=40905 Win=24820 Len=0"
"309608","5307.040609","202.77.162.213","172.16.115.20","RSH","1514","Server username:root Server -> Client Data"
"309609","5307.040796","172.16.115.20","202.77.162.213","TCP","60","1022  >  514 [ACK] Seq=75 Ack=43825 Win=24820 Len=0"
"309610","5307.041835","202.77.162.213","172.16.115.20","RSH","431","Server username:root Server -> Client Data"
"309611","5307.042393","172.16.115.20","202.77.162.213","RSH","60","Server username:root Client -> Server data"
"309612","5307.044484","202.77.162.213","172.16.115.20","TCP","60","514  >  1022 [FIN, ACK] Seq=44202 Ack=76 Win=33580 Len=0"
"309613","5307.044609","172.16.115.20","202.77.162.213","TCP","60","1022  >  514 [ACK] Seq=76 Ack=44203 Win=24820 Len=0"
"309614","5307.044794","172.16.115.20","202.77.162.213","TCP","60","1022  >  514 [FIN, ACK] Seq=76 Ack=44203 Win=24820 Len=0"
"309615","5307.044916","202.77.162.213","172.16.115.20","TCP","60","514  >  1022 [ACK] Seq=44203 Ack=77 Win=33580 Len=0"
"309628","5307.096279","172.16.115.20","202.77.162.213","TCP","60","[TCP Port numbers reused] 1022  >  514 [SYN] Seq=0 Win=8760 Len=0 MSS=1460"
"309629","5307.096426","202.77.162.213","172.16.115.20","TCP","60","514  >  1022 [SYN, ACK] Seq=0 Ack=1 Win=33580 Len=0 MSS=1460"
"309630","5307.096626","172.16.115.20","202.77.162.213","TCP","60","1022  >  514 [ACK] Seq=1 Ack=1 Win=8760 Len=0"
"309631","5307.096819","172.16.115.20","202.77.162.213","RSH","60","Session Establishment"
"309635","5307.269112","202.77.162.213","172.16.115.20","TCP","60","514  >  1022 [ACK] Seq=1 Ack=2 Win=33580 Len=0"
"309636","5307.269361","172.16.115.20","202.77.162.213","RSH","139","Session Establishment"
"309643","5307.469087","202.77.162.213","172.16.115.20","TCP","60","514  >  1022 [ACK] Seq=1 Ack=87 Win=33580 Len=0"
"309708","5308.154930","202.77.162.213","172.16.115.20","RSH","60","Server username:root Server -> Client Data"
"309709","5308.155103","172.16.115.20","202.77.162.213","TCP","60","1022  >  514 [ACK] Seq=87 Ack=2 Win=8760 Len=0"
"309710","5308.208565","202.77.162.213","172.16.115.20","RSH","105","Server username:root Server -> Client Data"
"309711","5308.208895","172.16.115.20","202.77.162.213","TCP","60","1022  >  514 [FIN, ACK] Seq=87 Ack=53 Win=8760 Len=0"
"309712","5308.209035","202.77.162.213","172.16.115.20","TCP","60","514  >  1022 [ACK] Seq=53 Ack=88 Win=33580 Len=0"
"309713","5308.209138","202.77.162.213","172.16.115.20","TCP","60","514  >  1022 [FIN, ACK] Seq=53 Ack=88 Win=33580 Len=0"
"309714","5308.209280","172.16.115.20","202.77.162.213","TCP","60","1022  >  514 [ACK] Seq=88 Ack=54 Win=8760 Len=0"
"309715","5308.210136","172.16.115.20","202.77.162.213","TCP","60","1021  >  514 [SYN] Seq=0 Win=8760 Len=0 MSS=1460"
"309716","5308.210308","202.77.162.213","172.16.115.20","TCP","60","514  >  1021 [SYN, ACK] Seq=0 Ack=1 Win=33580 Len=0 MSS=1460"
"309717","5308.210473","172.16.115.20","202.77.162.213","TCP","60","1021  >  514 [ACK] Seq=1 Ack=1 Win=8760 Len=0"
"309718","5308.210593","172.16.115.20","202.77.162.213","RSH","60","Session Establishment"
"309719","5308.269069","202.77.162.213","172.16.115.20","TCP","60","514  >  1021 [ACK] Seq=1 Ack=2 Win=33580 Len=0"
"309720","5308.269287","172.16.115.20","202.77.162.213","RSH","125","Session Establishment"
"309729","5308.469024","202.77.162.213","172.16.115.20","TCP","60","514  >  1021 [ACK] Seq=1 Ack=73 Win=33580 Len=0"
"309771","5309.330811","202.77.162.213","172.16.115.20","RSH","60","Server username:root Server -> Client Data"
"309772","5309.330966","172.16.115.20","202.77.162.213","TCP","60","1021  >  514 [ACK] Seq=73 Ack=2 Win=8760 Len=0"
"309773","5309.331298","172.16.115.20","202.77.162.213","RSH","60","Server username:root Client -> Server data"
"309777","5309.391035","202.77.162.213","172.16.115.20","RSH","77","Server username:root Server -> Client Data"
"309778","5309.392225","172.16.115.20","202.77.162.213","RSH","60","Server username:root Client -> Server data"
"309779","5309.399125","202.77.162.213","172.16.115.20","RSH","1514","Server username:root Server -> Client Data"
"309780","5309.400409","202.77.162.213","172.16.115.20","RSH","1514","Server username:root Server -> Client Data"
"309781","5309.401642","202.77.162.213","172.16.115.20","RSH","1514","Server username:root Server -> Client Data"
"309782","5309.401720","172.16.115.20","202.77.162.213","TCP","60","1021  >  514 [ACK] Seq=75 Ack=1485 Win=24820 Len=0"
"309783","5309.402977","202.77.162.213","172.16.115.20","RSH","1514","Server username:root Server -> Client Data"
"309784","5309.403052","172.16.115.20","202.77.162.213","TCP","60","1021  >  514 [ACK] Seq=75 Ack=2945 Win=24820 Len=0"
"309785","5309.403151","172.16.115.20","202.77.162.213","TCP","60","1021  >  514 [ACK] Seq=75 Ack=5865 Win=24820 Len=0"
"309786","5309.407983","202.77.162.213","172.16.115.20","RSH","1514","Server username:root Server -> Client Data"
"309787","5309.409274","202.77.162.213","172.16.115.20","RSH","1514","Server username:root Server -> Client Data"
"309788","5309.410493","202.77.162.213","172.16.115.20","RSH","1514","Server username:root Server -> Client Data"
"309789","5309.410572","172.16.115.20","202.77.162.213","TCP","60","1021  >  514 [ACK] Seq=75 Ack=8785 Win=24820 Len=0"
"309790","5309.411819","202.77.162.213","172.16.115.20","RSH","1514","Server username:root Server -> Client Data"
"309791","5309.413059","202.77.162.213","172.16.115.20","RSH","1514","Server username:root Server -> Client Data"
"309792","5309.413134","172.16.115.20","202.77.162.213","TCP","60","1021  >  514 [ACK] Seq=75 Ack=11705 Win=24820 Len=0"
"309793","5309.414445","202.77.162.213","172.16.115.20","RSH","1514","Server username:root Server -> Client Data"
"309794","5309.414628","172.16.115.20","202.77.162.213","TCP","60","1021  >  514 [ACK] Seq=75 Ack=14625 Win=24820 Len=0"
"309795","5309.417345","202.77.162.213","172.16.115.20","RSH","1514","Server username:root Server -> Client Data"
"309796","5309.418633","202.77.162.213","172.16.115.20","RSH","1514","Server username:root Server -> Client Data"
"309797","5309.418806","172.16.115.20","202.77.162.213","TCP","60","1021  >  514 [ACK] Seq=75 Ack=17545 Win=24820 Len=0"
"309798","5309.420037","202.77.162.213","172.16.115.20","RSH","1514","Server username:root Server -> Client Data"
"309799","5309.421894","202.77.162.213","172.16.115.20","RSH","1514","Server username:root Server -> Client Data"
"309800","5309.423127","202.77.162.213","172.16.115.20","RSH","1514","Server username:root Server -> Client Data"
"309801","5309.423207","172.16.115.20","202.77.162.213","TCP","60","1021  >  514 [ACK] Seq=75 Ack=20465 Win=24820 Len=0"
"309802","5309.424586","202.77.162.213","172.16.115.20","RSH","1514","Server username:root Server -> Client Data"
"309803","5309.425810","202.77.162.213","172.16.115.20","RSH","1514","Server username:root Server -> Client Data"
"309804","5309.425886","172.16.115.20","202.77.162.213","TCP","60","1021  >  514 [ACK] Seq=75 Ack=23385 Win=24820 Len=0"
"309805","5309.427119","202.77.162.213","172.16.115.20","RSH","1514","Server username:root Server -> Client Data"
"309806","5309.428458","202.77.162.213","172.16.115.20","RSH","1514","Server username:root Server -> Client Data"
"309807","5309.428536","172.16.115.20","202.77.162.213","TCP","60","1021  >  514 [ACK] Seq=75 Ack=26305 Win=24820 Len=0"
"309808","5309.429769","202.77.162.213","172.16.115.20","RSH","1514","Server username:root Server -> Client Data"
"309809","5309.431011","202.77.162.213","172.16.115.20","RSH","1514","Server username:root Server -> Client Data"
"309810","5309.431079","172.16.115.20","202.77.162.213","TCP","60","1021  >  514 [ACK] Seq=75 Ack=29225 Win=24820 Len=0"
"309811","5309.432475","202.77.162.213","172.16.115.20","RSH","1514","Server username:root Server -> Client Data"
"309812","5309.433707","202.77.162.213","172.16.115.20","RSH","1514","Server username:root Server -> Client Data"
"309813","5309.434938","202.77.162.213","172.16.115.20","RSH","1514","Server username:root Server -> Client Data"
"309814","5309.435043","172.16.115.20","202.77.162.213","TCP","60","1021  >  514 [ACK] Seq=75 Ack=32145 Win=24820 Len=0"
"309815","5309.436274","202.77.162.213","172.16.115.20","RSH","1514","Server username:root Server -> Client Data"
"309816","5309.436355","172.16.115.20","202.77.162.213","TCP","60","1021  >  514 [ACK] Seq=75 Ack=35065 Win=24820 Len=0"
"309817","5309.439368","202.77.162.213","172.16.115.20","RSH","1514","Server username:root Server -> Client Data"
"309818","5309.440640","202.77.162.213","172.16.115.20","RSH","1514","Server username:root Server -> Client Data"
"309819","5309.440719","172.16.115.20","202.77.162.213","TCP","60","1021  >  514 [ACK] Seq=75 Ack=37985 Win=24820 Len=0"
"309820","5309.442044","202.77.162.213","172.16.115.20","RSH","1514","Server username:root Server -> Client Data"
"309821","5309.443279","202.77.162.213","172.16.115.20","RSH","1514","Server username:root Server -> Client Data"
"309822","5309.443353","172.16.115.20","202.77.162.213","TCP","60","1021  >  514 [ACK] Seq=75 Ack=40905 Win=24820 Len=0"
"309823","5309.444586","202.77.162.213","172.16.115.20","RSH","1514","Server username:root Server -> Client Data"
"309824","5309.445831","202.77.162.213","172.16.115.20","RSH","1514","Server username:root Server -> Client Data"
"309825","5309.447050","202.77.162.213","172.16.115.20","RSH","1514","Server username:root Server -> Client Data"
"309826","5309.447130","172.16.115.20","202.77.162.213","TCP","60","1021  >  514 [ACK] Seq=75 Ack=43825 Win=24820 Len=0"
"309827","5309.448361","202.77.162.213","172.16.115.20","RSH","1514","Server username:root Server -> Client Data"
"309828","5309.448439","172.16.115.20","202.77.162.213","TCP","60","1021  >  514 [ACK] Seq=75 Ack=46745 Win=24820 Len=0"
"309829","5309.449844","202.77.162.213","172.16.115.20","RSH","1514","Server username:root Server -> Client Data"
"309830","5309.451075","202.77.162.213","172.16.115.20","RSH","1514","Server username:root Server -> Client Data"
"309831","5309.451155","172.16.115.20","202.77.162.213","TCP","60","1021  >  514 [ACK] Seq=75 Ack=49665 Win=24820 Len=0"
"309832","5309.452397","202.77.162.213","172.16.115.20","RSH","1514","Server username:root Server -> Client Data"
"309833","5309.453622","202.77.162.213","172.16.115.20","RSH","1514","Server username:root Server -> Client Data"
"309834","5309.453697","172.16.115.20","202.77.162.213","TCP","60","1021  >  514 [ACK] Seq=75 Ack=52585 Win=24820 Len=0"
"309835","5309.455049","202.77.162.213","172.16.115.20","RSH","1514","Server username:root Server -> Client Data"
"309836","5309.456293","202.77.162.213","172.16.115.20","RSH","1514","Server username:root Server -> Client Data"
"309837","5309.456371","172.16.115.20","202.77.162.213","TCP","60","1021  >  514 [ACK] Seq=75 Ack=55505 Win=24820 Len=0"
"309838","5309.457646","202.77.162.213","172.16.115.20","RSH","1514","Server username:root Server -> Client Data"
"309839","5309.457831","172.16.115.20","202.77.162.213","TCP","60","1021  >  514 [ACK] Seq=75 Ack=58425 Win=24820 Len=0"
"309840","5309.460922","202.77.162.213","172.16.115.20","RSH","1003","Server username:root Server -> Client Data"
"309841","5309.461461","172.16.115.20","202.77.162.213","RSH","60","Server username:root Client -> Server data"
"309842","5309.463560","202.77.162.213","172.16.115.20","TCP","60","514  >  1021 [FIN, ACK] Seq=59374 Ack=76 Win=33580 Len=0"
"309843","5309.463697","172.16.115.20","202.77.162.213","TCP","60","1021  >  514 [ACK] Seq=76 Ack=59375 Win=24820 Len=0"
"309844","5309.463882","172.16.115.20","202.77.162.213","TCP","60","1021  >  514 [FIN, ACK] Seq=76 Ack=59375 Win=24820 Len=0"
"309845","5309.464003","202.77.162.213","172.16.115.20","TCP","60","514  >  1021 [ACK] Seq=59375 Ack=77 Win=33580 Len=0"
"309863","5309.525828","202.77.162.213","172.16.115.20","TCP","74","1023  >  514 [SYN] Seq=0 Win=32768 Len=0 MSS=1460 WS=1 TSval=186596 TSecr=0"
"309864","5309.526089","172.16.115.20","202.77.162.213","TCP","74","514  >  1023 [SYN, ACK] Seq=0 Ack=1 Win=10136 Len=0 TSval=9212996 TSecr=186596 WS=1 MSS=1460"
"309866","5309.526238","202.77.162.213","172.16.115.20","TCP","66","1023  >  514 [ACK] Seq=1 Ack=1 Win=33580 Len=0 TSval=186596 TSecr=9212996"
"309868","5309.527237","202.77.162.213","172.16.115.20","RSH","71","Session Establishment"
"309869","5309.527369","172.16.115.20","202.77.162.213","TCP","66","514  >  1023 [ACK] Seq=1 Ack=6 Win=10131 Len=0 TSval=9212997 TSecr=186596"
"309952","5310.571225","202.77.162.213","172.16.115.20","RSH","71","Session Establishment"
"309953","5310.571412","172.16.115.20","202.77.162.213","TCP","66","514  >  1023 [ACK] Seq=1 Ack=11 Win=10136 Len=0 TSval=9213101 TSecr=186598"
"310065","5310.670288","202.77.162.213","172.16.115.20","RSH","99","Session Establishment"
"310066","5310.688784","172.16.115.20","202.77.162.213","RSH","67","Server username:hacker2 Server -> Client Data"
"310067","5310.691154","202.77.162.213","172.16.115.20","TCP","66","1023  >  514 [FIN, ACK] Seq=44 Ack=2 Win=33580 Len=0 TSval=186598 TSecr=9213113"
"310068","5310.691353","172.16.115.20","202.77.162.213","TCP","66","514  >  1023 [ACK] Seq=2 Ack=45 Win=10136 Len=0 TSval=9213113 TSecr=186598"
"310092","5310.764593","172.16.115.20","202.77.162.213","RSH","99","Server username:hacker2 Server -> Client Data"
"310093","5310.764734","202.77.162.213","172.16.115.20","TCP","60","1023  >  514 [RST] Seq=45 Win=0 Len=0"
"310526","5324.547048","202.77.162.213","172.16.115.20","TCP","74","[TCP Port numbers reused] 1023  >  514 [SYN] Seq=0 Win=32768 Len=0 MSS=1460 WS=1 TSval=186626 TSecr=0"
"310527","5324.547332","172.16.115.20","202.77.162.213","TCP","74","514  >  1023 [SYN, ACK] Seq=0 Ack=1 Win=10136 Len=0 TSval=9214499 TSecr=186626 WS=1 MSS=1460"
"310528","5324.547486","202.77.162.213","172.16.115.20","TCP","66","1023  >  514 [ACK] Seq=1 Ack=1 Win=33580 Len=0 TSval=186626 TSecr=9214499"
"310529","5324.547945","202.77.162.213","172.16.115.20","RSH","71","Session Establishment"
"310530","5324.548215","172.16.115.20","202.77.162.213","TCP","66","514  >  1023 [ACK] Seq=1 Ack=6 Win=10136 Len=0 TSval=9214499 TSecr=186626"
"310548","5324.669577","202.77.162.213","172.16.115.20","RSH","118","Session Establishment"
"310550","5324.688239","172.16.115.20","202.77.162.213","RSH","67","Server username:hacker2 Server -> Client Data"
"310551","5324.690737","202.77.162.213","172.16.115.20","TCP","66","1023  >  514 [FIN, ACK] Seq=58 Ack=2 Win=33580 Len=0 TSval=186626 TSecr=9214513"
"310552","5324.690922","172.16.115.20","202.77.162.213","TCP","66","514  >  1023 [ACK] Seq=2 Ack=59 Win=10136 Len=0 TSval=9214513 TSecr=186626"
"310556","5324.755698","172.16.115.20","202.77.162.213","RSH","124","Server username:hacker2 Server -> Client Data"
"310557","5324.755812","202.77.162.213","172.16.115.20","TCP","60","1023  >  514 [RST] Seq=59 Win=0 Len=0"
"310571","5324.845171","172.16.112.10","202.77.162.213","TCP","58","1023  >  514 [SYN] Seq=0 Win=8760 Len=0 MSS=1460"
"310572","5324.845506","202.77.162.213","172.16.112.10","TCP","60","514  >  1023 [SYN, ACK] Seq=0 Ack=1 Win=33580 Len=0 MSS=1460"
"310573","5324.845599","172.16.112.10","202.77.162.213","TCP","54","1023  >  514 [ACK] Seq=1 Ack=1 Win=8760 Len=0"
"310574","5324.845814","172.16.112.10","202.77.162.213","RSH","55","Session Establishment"
"310575","5324.868036","202.77.162.213","172.16.112.10","TCP","60","514  >  1023 [ACK] Seq=1 Ack=2 Win=33580 Len=0"
"310576","5324.868137","172.16.112.10","202.77.162.213","RSH","139","Session Establishment"
"310577","5324.967541","202.77.162.213","172.16.112.10","RSH","60","Server username:root Server -> Client Data"
"310578","5325.016106","172.16.112.10","202.77.162.213","TCP","54","1023  >  514 [ACK] Seq=87 Ack=2 Win=8760 Len=0"
"310579","5325.021150","202.77.162.213","172.16.112.10","RSH","105","Server username:root Server -> Client Data"
"310580","5325.021471","172.16.112.10","202.77.162.213","TCP","54","1023  >  514 [FIN, ACK] Seq=87 Ack=53 Win=8760 Len=0"
"310581","5325.021698","202.77.162.213","172.16.112.10","TCP","60","514  >  1023 [FIN, ACK] Seq=53 Ack=87 Win=33580 Len=0"
"310582","5325.021920","202.77.162.213","172.16.112.10","TCP","60","[TCP Out-Of-Order] 514  >  1023 [FIN, ACK] Seq=53 Ack=88 Win=33580 Len=0"
"310583","5325.022030","172.16.112.10","202.77.162.213","TCP","54","1023  >  514 [ACK] Seq=88 Ack=54 Win=8760 Len=0"
"310584","5325.022120","172.16.112.10","202.77.162.213","TCP","54","[TCP Dup ACK 310583#1] 1023  >  514 [ACK] Seq=88 Ack=54 Win=8760 Len=0"
"310585","5325.023240","172.16.112.10","202.77.162.213","TCP","58","1022  >  514 [SYN] Seq=0 Win=8760 Len=0 MSS=1460"
"310586","5325.023558","202.77.162.213","172.16.112.10","TCP","60","514  >  1022 [SYN, ACK] Seq=0 Ack=1 Win=33580 Len=0 MSS=1460"
"310587","5325.023646","172.16.112.10","202.77.162.213","TCP","54","1022  >  514 [ACK] Seq=1 Ack=1 Win=8760 Len=0"
"310588","5325.023840","172.16.112.10","202.77.162.213","RSH","55","Session Establishment"
"310589","5325.067988","202.77.162.213","172.16.112.10","TCP","60","514  >  1022 [ACK] Seq=1 Ack=2 Win=33580 Len=0"
"310590","5325.068104","172.16.112.10","202.77.162.213","RSH","125","Session Establishment"
"310591","5325.256251","172.16.112.10","202.77.162.213","TCP","125","[TCP Retransmission] 1022  >  514 [PSH, ACK] Seq=2 Ack=1 Win=8760 Len=71"
"310592","5325.256558","202.77.162.213","172.16.112.10","TCP","60","514  >  1022 [ACK] Seq=1 Ack=73 Win=33580 Len=0"
"310593","5326.135532","202.77.162.213","172.16.112.10","RSH","60","Server username:root Server -> Client Data"
"310594","5326.135814","172.16.112.10","202.77.162.213","RSH","55","Server username:root Client -> Server data"
"310595","5326.194250","202.77.162.213","172.16.112.10","RSH","77","Server username:root Server -> Client Data"
"310596","5326.194965","172.16.112.10","202.77.162.213","RSH","55","Server username:root Client -> Server data"
"310597","5326.202136","202.77.162.213","172.16.112.10","RSH","1514","Server username:root Server -> Client Data"
"310598","5326.202188","172.16.112.10","202.77.162.213","TCP","54","1022  >  514 [ACK] Seq=75 Ack=1485 Win=24820 Len=0"
"310599","5326.203374","202.77.162.213","172.16.112.10","RSH","1514","Server username:root Server -> Client Data"
"310600","5326.204617","202.77.162.213","172.16.112.10","RSH","1514","Server username:root Server -> Client Data"
"310601","5326.204667","172.16.112.10","202.77.162.213","TCP","54","1022  >  514 [ACK] Seq=75 Ack=4405 Win=24820 Len=0"
"310602","5326.205916","202.77.162.213","172.16.112.10","RSH","1514","Server username:root Server -> Client Data"
"310603","5326.210913","202.77.162.213","172.16.112.10","RSH","1514","Server username:root Server -> Client Data"
"310604","5326.212219","202.77.162.213","172.16.112.10","RSH","1514","Server username:root Server -> Client Data"
"310605","5326.212262","172.16.112.10","202.77.162.213","TCP","54","1022  >  514 [ACK] Seq=75 Ack=8785 Win=24820 Len=0"
"310606","5326.213428","202.77.162.213","172.16.112.10","RSH","1514","Server username:root Server -> Client Data"
"310607","5326.214746","202.77.162.213","172.16.112.10","RSH","1514","Server username:root Server -> Client Data"
"310608","5326.215974","202.77.162.213","172.16.112.10","RSH","1514","Server username:root Server -> Client Data"
"310609","5326.217304","202.77.162.213","172.16.112.10","RSH","1514","Server username:root Server -> Client Data"
"310610","5326.217372","172.16.112.10","202.77.162.213","TCP","54","1022  >  514 [ACK] Seq=75 Ack=14625 Win=24820 Len=0"
"310611","5326.220275","202.77.162.213","172.16.112.10","RSH","1514","Server username:root Server -> Client Data"
"310612","5326.221541","202.77.162.213","172.16.112.10","RSH","1514","Server username:root Server -> Client Data"
"310613","5326.222781","202.77.162.213","172.16.112.10","RSH","1514","Server username:root Server -> Client Data"
"310614","5326.225929","202.77.162.213","172.16.112.10","RSH","1514","Server username:root Server -> Client Data"
"310615","5326.227194","202.77.162.213","172.16.112.10","RSH","1514","Server username:root Server -> Client Data"
"310616","5326.227304","172.16.112.10","202.77.162.213","TCP","54","1022  >  514 [ACK] Seq=75 Ack=21925 Win=24820 Len=0"
"310617","5326.228545","202.77.162.213","172.16.112.10","RSH","1514","Server username:root Server -> Client Data"
"310618","5326.229767","202.77.162.213","172.16.112.10","RSH","1514","Server username:root Server -> Client Data"
"310619","5326.231092","202.77.162.213","172.16.112.10","RSH","1514","Server username:root Server -> Client Data"
"310620","5326.232479","202.77.162.213","172.16.112.10","RSH","1514","Server username:root Server -> Client Data"
"310621","5326.233748","202.77.162.213","172.16.112.10","RSH","1514","Server username:root Server -> Client Data"
"310622","5326.235012","202.77.162.213","172.16.112.10","RSH","1514","Server username:root Server -> Client Data"
"310623","5326.235057","172.16.112.10","202.77.162.213","TCP","54","1022  >  514 [ACK] Seq=75 Ack=30685 Win=24820 Len=0"
"310624","5326.236360","202.77.162.213","172.16.112.10","RSH","1514","Server username:root Server -> Client Data"
"310625","5326.237573","202.77.162.213","172.16.112.10","RSH","1514","Server username:root Server -> Client Data"
"310626","5326.238889","202.77.162.213","172.16.112.10","RSH","1514","Server username:root Server -> Client Data"
"310627","5326.240117","202.77.162.213","172.16.112.10","RSH","1514","Server username:root Server -> Client Data"
"310628","5326.241400","202.77.162.213","172.16.112.10","RSH","1514","Server username:root Server -> Client Data"
"310629","5326.242741","202.77.162.213","172.16.112.10","RSH","1514","Server username:root Server -> Client Data"
"310630","5326.244050","202.77.162.213","172.16.112.10","RSH","1514","Server username:root Server -> Client Data"
"310631","5326.244095","172.16.112.10","202.77.162.213","TCP","54","1022  >  514 [ACK] Seq=75 Ack=40905 Win=24820 Len=0"
"310632","5326.245289","202.77.162.213","172.16.112.10","RSH","1514","Server username:root Server -> Client Data"
"310633","5326.246827","202.77.162.213","172.16.112.10","RSH","1514","Server username:root Server -> Client Data"
"310634","5326.296455","172.16.112.10","202.77.162.213","TCP","54","1022  >  514 [ACK] Seq=75 Ack=43825 Win=24820 Len=0"
"310635","5326.297022","202.77.162.213","172.16.112.10","RSH","431","Server username:root Server -> Client Data"
"310636","5326.297374","172.16.112.10","202.77.162.213","RSH","55","Server username:root Client -> Server data"
"310637","5326.299696","202.77.162.213","172.16.112.10","TCP","60","514  >  1022 [FIN, ACK] Seq=44202 Ack=76 Win=33580 Len=0"
"310638","5326.299741","172.16.112.10","202.77.162.213","TCP","54","1022  >  514 [ACK] Seq=76 Ack=44203 Win=24820 Len=0"
"310639","5326.300037","172.16.112.10","202.77.162.213","TCP","54","1022  >  514 [FIN, ACK] Seq=76 Ack=44203 Win=24820 Len=0"
"310640","5326.300313","202.77.162.213","172.16.112.10","TCP","60","514  >  1022 [ACK] Seq=44203 Ack=77 Win=33580 Len=0"
"311214","5341.381620","202.77.162.213","172.16.112.10","TCP","74","1023  >  514 [SYN] Seq=0 Win=32768 Len=0 MSS=1460 WS=1 TSval=186660 TSecr=0"
"311215","5341.381865","172.16.112.10","202.77.162.213","TCP","58","514  >  1023 [SYN, ACK] Seq=0 Ack=1 Win=8760 Len=0 MSS=1460"
"311216","5341.382134","202.77.162.213","172.16.112.10","TCP","60","1023  >  514 [ACK] Seq=1 Ack=1 Win=33580 Len=0"
"311217","5341.382759","202.77.162.213","172.16.112.10","RSH","60","Session Establishment"
"311223","5341.429597","172.16.112.10","202.77.162.213","TCP","54","514  >  1023 [ACK] Seq=1 Ack=6 Win=8760 Len=0"
"311228","5341.468695","202.77.162.213","172.16.112.10","RSH","106","Session Establishment"
"311229","5341.484127","172.16.112.10","202.77.162.213","RSH","55","Server username:hacker2 Server -> Client Data"
"311230","5341.486826","202.77.162.213","172.16.112.10","TCP","60","1023  >  514 [FIN, ACK] Seq=58 Ack=2 Win=33580 Len=0"
"311231","5341.486894","172.16.112.10","202.77.162.213","TCP","54","514  >  1023 [ACK] Seq=2 Ack=59 Win=8760 Len=0"
"311242","5341.531512","172.16.112.10","202.77.162.213","RSH","112","Server username:hacker2 Server -> Client Data"
"311243","5341.532032","202.77.162.213","172.16.112.10","TCP","60","1023  >  514 [RST] Seq=59 Win=0 Len=0"
"311262","5341.802007","172.16.112.50","202.77.162.213","TCP","60","1023  >  514 [SYN] Seq=0 Win=8760 Len=0 MSS=1460"
"311263","5341.802174","202.77.162.213","172.16.112.50","TCP","60","514  >  1023 [SYN, ACK] Seq=0 Ack=1 Win=33580 Len=0 MSS=1460"
"311264","5341.802417","172.16.112.50","202.77.162.213","TCP","60","1023  >  514 [ACK] Seq=1 Ack=1 Win=8760 Len=0"
"311265","5341.802608","172.16.112.50","202.77.162.213","RSH","60","Session Establishment"
"311269","5341.866975","202.77.162.213","172.16.112.50","TCP","60","514  >  1023 [ACK] Seq=1 Ack=2 Win=33580 Len=0"
"311270","5341.867179","172.16.112.50","202.77.162.213","RSH","139","Session Establishment"
"311271","5341.947100","202.77.162.213","172.16.112.50","RSH","60","Server username:root Server -> Client Data"
"311272","5341.979029","202.77.162.213","172.16.112.50","RSH","105","Server username:root Server -> Client Data"
"311273","5341.979189","172.16.112.50","202.77.162.213","TCP","60","1023  >  514 [ACK] Seq=87 Ack=54 Win=8760 Len=0"
"311274","5341.979519","172.16.112.50","202.77.162.213","TCP","60","1023  >  514 [FIN, ACK] Seq=87 Ack=54 Win=8760 Len=0"
"311275","5341.979645","202.77.162.213","172.16.112.50","TCP","60","514  >  1023 [ACK] Seq=54 Ack=88 Win=33580 Len=0"
"311276","5341.981512","172.16.112.50","202.77.162.213","TCP","60","[TCP Port numbers reused] 1023  >  514 [SYN] Seq=0 Win=8760 Len=0 MSS=1460"
"311277","5341.981662","202.77.162.213","172.16.112.50","TCP","60","514  >  1023 [SYN, ACK] Seq=0 Ack=1 Win=33580 Len=0 MSS=1460"
"311278","5341.981836","172.16.112.50","202.77.162.213","TCP","60","1023  >  514 [ACK] Seq=1 Ack=1 Win=8760 Len=0"
"311279","5341.981988","172.16.112.50","202.77.162.213","RSH","60","Session Establishment"
"311280","5342.066925","202.77.162.213","172.16.112.50","TCP","60","514  >  1023 [ACK] Seq=1 Ack=2 Win=33580 Len=0"
"311281","5342.067126","172.16.112.50","202.77.162.213","RSH","125","Session Establishment"
"311285","5342.147399","202.77.162.213","172.16.112.50","RSH","60","Server username:root Server -> Client Data"
"311286","5342.147799","172.16.112.50","202.77.162.213","RSH","60","Server username:root Client -> Server data"
"311287","5342.206464","202.77.162.213","172.16.112.50","RSH","77","Server username:root Server -> Client Data"
"311288","5342.207494","172.16.112.50","202.77.162.213","RSH","60","Server username:root Client -> Server data"
"311289","5342.214566","202.77.162.213","172.16.112.50","RSH","1514","Server username:root Server -> Client Data"
"311290","5342.215837","202.77.162.213","172.16.112.50","RSH","1514","Server username:root Server -> Client Data"
"311291","5342.217060","202.77.162.213","172.16.112.50","RSH","1514","Server username:root Server -> Client Data"
"311292","5342.217137","172.16.112.50","202.77.162.213","TCP","60","1023  >  514 [ACK] Seq=75 Ack=1485 Win=24820 Len=0"
"311293","5342.217263","172.16.112.50","202.77.162.213","TCP","60","1023  >  514 [ACK] Seq=75 Ack=4405 Win=24820 Len=0"
"311294","5342.218497","202.77.162.213","172.16.112.50","RSH","1514","Server username:root Server -> Client Data"
"311295","5342.223484","202.77.162.213","172.16.112.50","RSH","1514","Server username:root Server -> Client Data"
"311296","5342.224772","202.77.162.213","172.16.112.50","RSH","1514","Server username:root Server -> Client Data"
"311297","5342.226017","202.77.162.213","172.16.112.50","RSH","1514","Server username:root Server -> Client Data"
"311298","5342.226084","172.16.112.50","202.77.162.213","TCP","60","1023  >  514 [ACK] Seq=75 Ack=8785 Win=24820 Len=0"
"311299","5342.227320","202.77.162.213","172.16.112.50","RSH","1514","Server username:root Server -> Client Data"
"311300","5342.228552","202.77.162.213","172.16.112.50","RSH","1514","Server username:root Server -> Client Data"
"311301","5342.229996","202.77.162.213","172.16.112.50","RSH","1514","Server username:root Server -> Client Data"
"311302","5342.230184","172.16.112.50","202.77.162.213","TCP","60","1023  >  514 [ACK] Seq=75 Ack=14625 Win=24820 Len=0"
"311303","5342.232865","202.77.162.213","172.16.112.50","RSH","1514","Server username:root Server -> Client Data"
"311304","5342.234238","202.77.162.213","172.16.112.50","RSH","1514","Server username:root Server -> Client Data"
"311305","5342.235458","202.77.162.213","172.16.112.50","RSH","1514","Server username:root Server -> Client Data"
"311306","5342.236764","202.77.162.213","172.16.112.50","RSH","1514","Server username:root Server -> Client Data"
"311307","5342.237994","202.77.162.213","172.16.112.50","RSH","1514","Server username:root Server -> Client Data"
"311308","5342.238182","172.16.112.50","202.77.162.213","TCP","60","1023  >  514 [ACK] Seq=75 Ack=21925 Win=24820 Len=0"
"311309","5342.239466","202.77.162.213","172.16.112.50","RSH","1514","Server username:root Server -> Client Data"
"311310","5342.241383","202.77.162.213","172.16.112.50","RSH","1514","Server username:root Server -> Client Data"
"311311","5342.242641","202.77.162.213","172.16.112.50","RSH","1514","Server username:root Server -> Client Data"
"311312","5342.243873","202.77.162.213","172.16.112.50","RSH","1514","Server username:root Server -> Client Data"
"311313","5342.245241","202.77.162.213","172.16.112.50","RSH","1514","Server username:root Server -> Client Data"
"311314","5342.246651","202.77.162.213","172.16.112.50","RSH","1514","Server username:root Server -> Client Data"
"311315","5342.247952","202.77.162.213","172.16.112.50","RSH","1514","Server username:root Server -> Client Data"
"311316","5342.249179","202.77.162.213","172.16.112.50","RSH","1514","Server username:root Server -> Client Data"
"311317","5342.249261","172.16.112.50","202.77.162.213","TCP","60","1023  >  514 [ACK] Seq=75 Ack=30685 Win=24820 Len=0"
"311318","5342.250497","202.77.162.213","172.16.112.50","RSH","1514","Server username:root Server -> Client Data"
"311319","5342.251727","202.77.162.213","172.16.112.50","RSH","1514","Server username:root Server -> Client Data"
"311320","5342.256314","202.77.162.213","172.16.112.50","RSH","1514","Server username:root Server -> Client Data"
"311321","5342.257605","202.77.162.213","172.16.112.50","RSH","1514","Server username:root Server -> Client Data"
"311322","5342.258947","202.77.162.213","172.16.112.50","RSH","1514","Server username:root Server -> Client Data"
"311323","5342.260183","202.77.162.213","172.16.112.50","RSH","1514","Server username:root Server -> Client Data"
"311324","5342.260260","172.16.112.50","202.77.162.213","TCP","60","1023  >  514 [ACK] Seq=75 Ack=40905 Win=24820 Len=0"
"311325","5342.261529","202.77.162.213","172.16.112.50","RSH","1514","Server username:root Server -> Client Data"
"311326","5342.305867","172.16.112.50","202.77.162.213","TCP","60","1023  >  514 [ACK] Seq=75 Ack=43825 Win=24820 Len=0"
"311327","5342.306300","202.77.162.213","172.16.112.50","RSH","431","Server username:root Server -> Client Data"
"311328","5342.306839","172.16.112.50","202.77.162.213","RSH","60","Server username:root Client -> Server data"
"311329","5342.308998","202.77.162.213","172.16.112.50","TCP","60","514  >  1023 [FIN, ACK] Seq=44202 Ack=76 Win=33580 Len=0"
"311330","5342.309142","172.16.112.50","202.77.162.213","TCP","60","1023  >  514 [ACK] Seq=76 Ack=44203 Win=24820 Len=0"
"311331","5342.309492","172.16.112.50","202.77.162.213","TCP","60","1023  >  514 [FIN, ACK] Seq=76 Ack=44203 Win=24820 Len=0"
"311332","5342.309614","202.77.162.213","172.16.112.50","TCP","60","514  >  1023 [ACK] Seq=44203 Ack=77 Win=33580 Len=0"
"311629","5357.384814","202.77.162.213","172.16.112.50","TCP","74","1023  >  514 [SYN] Seq=0 Win=32768 Len=0 MSS=1460 WS=1 TSval=186692 TSecr=0"
"311630","5357.385093","172.16.112.50","202.77.162.213","TCP","60","514  >  1023 [SYN, ACK] Seq=0 Ack=1 Win=8760 Len=0 MSS=1460"
"311631","5357.385245","202.77.162.213","172.16.112.50","TCP","60","1023  >  514 [ACK] Seq=1 Ack=1 Win=33580 Len=0"
"311632","5357.385674","202.77.162.213","172.16.112.50","RSH","60","Session Establishment"
"311633","5357.427925","172.16.112.50","202.77.162.213","TCP","60","514  >  1023 [ACK] Seq=1 Ack=6 Win=8760 Len=0"
"311637","5357.467737","202.77.162.213","172.16.112.50","RSH","106","Session Establishment"
"311638","5357.493353","172.16.112.50","202.77.162.213","RSH","60","Server username:hacker2 Server -> Client Data"
"311639","5357.495830","202.77.162.213","172.16.112.50","TCP","60","1023  >  514 [FIN, ACK] Seq=58 Ack=2 Win=33580 Len=0"
"311640","5357.496009","172.16.112.50","202.77.162.213","TCP","60","514  >  1023 [ACK] Seq=2 Ack=59 Win=8760 Len=0"
"311642","5357.572048","172.16.112.50","202.77.162.213","RSH","112","Server username:hacker2 Server -> Client Data"
"311643","5357.572175","202.77.162.213","172.16.112.50","TCP","60","1023  >  514 [RST] Seq=59 Win=0 Len=0"
